index,title_hindi,content_hindi,rating,labels,polarity,sentiment
36,"संगीत के लिए अच्छा है, फ़ोन कॉल के लिए नहीं","संगीत सुनना बहुत अच्छा है. उतार-चढ़ाव और बहुत संतुलित और यह प्रीमियम लगता है। एक घंटे से ज्यादा समय तक पहनने पर भी आराम महसूस होता है। एकमात्र नकारात्मक पक्ष यह है कि ईयरबड्स की ये जोड़ी उनके फोन कॉल को आसान नहीं बनाती है। दूसरी तरफ लगातार बहुत अधिक पृष्ठभूमि शोर हो रहा है और माइक स्पष्ट आवाज पकड़ने के लिए अच्छी तरह से डिज़ाइन नहीं किए गए हैं। इसलिए यदि आप अपने फ़ोन कॉल ढूंढ रहे हैं, तो कहीं और देखें",3,Neutral,0.2148,Positive
37,बहुत बुरा,"बोतल से घिसी-पिटी गंध आ रही है। मैंने इसे बस एक बार इस्तेमाल किया था और अब यह एक कोने में पड़ा हुआ है। सबसे खराब गुणवत्ता, केवल स्मार्ट मार्केटिंग नौटंकी। अपना पैसा बर्बाद मत करो",1,Negative,-0.1714,Negative
38,यह एक अच्छा लैपटॉप स्टैंड है,"यह मजबूत है और 15.6 इंच के लैपटॉप के लिए अच्छा काम करता है, मेरे लैपटॉप का वजन लगभग 2 किलोग्राम है और यह हिलता नहीं है। अच्छी खरीदारी.",5,Positive,0.5667,Positive
39,शोर के लिए अच्छे ईयरबड,अच्छा लगता है ðð» धन्यवाद शोर ट्व्स,3,Neutral,0.7,Positive
40,बैटरी प्रदर्शन,पूर्ण चार्ज के बाद यह केवल 3 से 4 घंटे तक काम करता है यदि आप इसे लगातार उपयोग करते हैं........ यह वास्तव में बेकार है ðððððð,2,Negative,-0.05,Negative
41,चार्ज,मुझे एर्गोनोमिक और लचीला डिज़ाइन पसंद है लेकिन मुझे इसके चार्ज करने का तरीका पसंद नहीं आया क्योंकि जब मैंने इसे 4 घंटे के लिए चार्ज किया... तो यह 2 स्पीड पर मुश्किल से 20 मिनट तक चला... मेरे पैसे की बर्बादी... मत करो इस बड़े घोटाले को खरीदें,1,Negative,-0.05,Negative
42,अतिरंजित कीमत,कीमत कम होनी चाहिए और तार लम्बा होना चाहिए,3,Neutral,0.0,Neutral
43,पूर्ण ट्रिमिंग के लिए उपयोगी नहीं है,"उपयोग के बाद, जिन लोगों को पूर्ण ट्रिमिंग की आवश्यकता होती है वे इस मशीन को नहीं खरीदते हैं, इस ट्रिमर में केवल आंशिक बाल ट्रिमिंग होती है।",1,Negative,0.0833,Positive
44,अब एक साल से काम कर रहा हूं. बहुत विश्वसनीय,"बहुत एर्गोनोमिक नहीं, लेकिन लंबी अवधि के लिए विश्वसनीय।",5,Positive,-0.075,Negative
45,बिजली की गंध आ रही है,मैं इसे गर्म पानी के लिए उपयोग करता हूं। पानी से बिजली जैसी गंध आ रही है। लेकिन इसकी कीमत और क्वालिटी ठीक है,3,Neutral,0.3333,Positive
46,पैसे की बर्बादी इसके लायक नहीं है,"मीडिया लोड नहीं किया जा सका. बोतल से बहुत रिसाव होता है और चाहे आप कितनी भी जोर से रगड़ें, सिपर वाला हिस्सा पीला हो जाता है और कुछ काले धब्बे बन जाते हैं जिन्हें हटाया नहीं जा सकता।",2,Negative,-0.0222,Neutral
47,खरोंचें,इस पंखे में कई खरोंचें हैं,2,Negative,0.5,Positive
48,कामकाजी जीवन काल - 1 महीना,"मैं अपने बेटों के बाल काटने के लिए एक कॉर्डेड क्लिपर लेना चाहता था क्योंकि कॉर्डलेस क्लिपर के लिए बार-बार बैटरी बदलने की आवश्यकता होती है। वाहल एक अच्छा ब्रांड लगा और उसने इसे खरीदने का फैसला किया। शुरुआत में, सब कुछ ठीक रहा...विभिन्न लंबाई के लिए लगभग 10-12 अटैचमेंट थे, क्लिपर्स ने अच्छा काम किया...बच्चे खुश, मैं खुश। और फिर शायद एक महीने से कुछ अधिक समय तक 1-2 बार उपयोग करने के बाद, क्लिपर्स ने काम करना बंद कर दिया!..बिना किसी कारण के! घर में कोई बिजली का उतार-चढ़ाव नहीं, कोई बिजली की कमी नहीं, कुछ भी नहीं... एक दिन, क्लिपर ने भूत को छोड़ने का फैसला किया! रिप्लेसमेंट:-मैंने सेट को बदलने की कोशिश की क्योंकि इसे खरीदे हुए कुछ ही महीने हुए थे। . दुर्भाग्य से कोई प्रतिस्थापन विकल्प नहीं हैं। मुझे उत्पाद पृष्ठ पर सूचीबद्ध हेल्पलाइन मिली और मैंने उन्हें कॉल किया। ऐसा लगता है कि दक्षिण में एकमात्र सेवा केंद्र हैदराबाद में है और मुझे उन्हें उत्पाद भेजना होगा, वे इसकी सेवा करेंगे और इसे वापस भेज देंगे जिसमें एक महीना लगेगा! पूरी प्रक्रिया ने मुझे ऐसा करने से हतोत्साहित किया। अंततः, मेरे पास एक ब्रांडेड क्लिपर है जो और कुछ नहीं बल्कि चारों ओर पड़ा हुआ प्लास्टिक और स्टील का एक टुकड़ा है, जो किसी के काम का नहीं है! 1200 रुपये बर्बाद!",1,Negative,0.207,Positive
49,बिजली कटौती के लिए जरूरी है,"मैंने हाल ही में फिलिप्स स्टेलर ब्राइट रिचार्जेबल इमरजेंसी इन्वर्टर एलईडी बल्ब खरीदा है और मैं इसके प्रदर्शन से बहुत प्रभावित हूं। यह बल्ब बिजली कटौती के दौरान उज्ज्वल, क्रिस्टल-स्पष्ट रोशनी प्रदान करता है, जिससे यह किसी भी घर के लिए एक आवश्यक वस्तु बन जाता है। मुझे विशेष रूप से यह पसंद है कि बल्ब रिचार्जेबल है, इसलिए मुझे हाथ में बैटरी होने के बारे में चिंता करने की ज़रूरत नहीं है। बल्ब को स्थापित करना और उपयोग करना भी बहुत आसान है।",3,Neutral,0.4233,Positive
